{
  "$schema": "./scenario.schema.json",
  "schemaVersion": "qbo-real-accountant-uat/v1",
  "packId": "qbo-real-accountant-sg-july-2026-v1",
  "title": "去标识化真实会计习惯 QuickBooks 连续对话 UAT",
  "description": "用 14 份纯虚构测试材料和 16 轮连续自然语言对话，验证 QuickBooks MCP 的读取、跨账本翻译、事实更正、受控写入、幂等与精确回读。",
  "sourceProvenance": {
    "sourceType": "SYNTHETIC_ACCOUNTING_TEST_PACK",
    "allBusinessNamesAndIdentifiersAreFictitious": true,
    "originalFilesCommitted": false,
    "derivedFromColleagueConversationStyle": true,
    "colleagueIdentityOrMetadataIncluded": false
  },
  "privacyBoundary": {
    "committedMaterial": [
      "logical artifact IDs",
      "fictitious document facts needed by the oracle",
      "SHA-256 environment placeholders",
      "sanitized natural-language turns"
    ],
    "prohibitedMaterial": [
      "original DOCX or Markdown exports",
      "internal Agent, Workspace, tenant or conversation IDs",
      "internal Drive URLs",
      "real colleague names, emails or document author metadata",
      "OAuth tokens, cookies or QuickBooks credentials"
    ]
  },
  "target": {
    "provider": "quickbooks",
    "ledgerRole": "FORMAL_SYSTEM_OF_RECORD",
    "environment": "QUICKBOOKS_SANDBOX_ONLY",
    "mcpEndpoint": "https://mcp.jiayuanwang.xyz/quickbooks/mcp",
    "onlineHost": {
      "name": "Work",
      "baseUrl": "https://work.zcloak.ai",
      "modelDisplayName": "DeepSeek V4",
      "modelId": "LIVE_VERIFY_IN_WORK_MODEL_SELECTOR"
    },
    "mcpIsolation": {
      "quickBooksAndXeroAreSeparateMcps": true,
      "requiredToolPrefix": "quickbooks_",
      "forbiddenToolPrefixes": [
        "xero_"
      ],
      "forbiddenLegacyToolsInAccountingCaseMode": [
        "quickbooks_hash_source_document",
        "quickbooks_prepare_supplier_bill",
        "quickbooks_prepare_mutation",
        "quickbooks_execute_confirmed_mutation"
      ]
    }
  },
  "actor": {
    "role": "ACCOUNTING_FIRM_ACCOUNTANT",
    "interactionStyle": [
      "short natural business prompts",
      "Chinese and English mixed",
      "occasional typos",
      "long-running conversation references such as 上述, 图7 and 文件A",
      "uploads arrive in more than one batch",
      "expects global correction rather than local patching",
      "does not name MCP tools"
    ]
  },
  "startingConditions": {
    "oauth": "OAUTH_BOUND_TO_THE_CURRENT_WORK_INSTALLATION_AND_ONE_SANDBOX_COMPANY",
    "homeCurrency": "SGD",
    "sandboxOnly": true,
    "requiredScopes": [
      "quickbooks.read",
      "quickbooks.mutation.prepare",
      "quickbooks.mutation.execute"
    ],
    "requiredStandingDelegationActions": [
      "customer.create_basic",
      "vendor.create_basic",
      "invoice.create",
      "bill.create",
      "credit_memo.create",
      "vendor_credit.create"
    ],
    "freshDataGate": {
      "exactContactNamesMustNotExist": [
        "Lion City Digital Pte. Ltd.",
        "OfficeHub Singapore Pte. Ltd."
      ],
      "documentNumbersMustNotExist": [
        "INV-2026-0702",
        "OH-260701",
        "CN-2026-0001",
        "OH-CN-260722"
      ],
      "dirtyBaselineResult": "BLOCKED_TEST_DATA_DIRTY",
      "destructiveCleanupAllowed": false
    },
    "quickBooksReferencePlaceholders": {
      "consultingItemName": "{{QBO_CONSULTING_ITEM_NAME}}",
      "officeExpensesAccountName": "{{QBO_OFFICE_EXPENSES_ACCOUNT_NAME}}",
      "salesGst9TaxCodeName": "{{QBO_SALES_GST_9_TAX_CODE_NAME}}",
      "purchasesGst9TaxCodeName": "{{QBO_PURCHASES_GST_9_TAX_CODE_NAME}}"
    }
  },
  "globalToolOracle": {
    "requiredReadBeforeWrite": [
      "quickbooks_connection_status",
      "quickbooks_resolve_target",
      "quickbooks_get_company",
      "quickbooks_search_customers",
      "quickbooks_search_vendors",
      "quickbooks_list_items",
      "quickbooks_list_accounts",
      "quickbooks_list_tax_codes"
    ],
    "onlyReleasedWriteTools": [
      "quickbooks_prepare_accounting_case",
      "quickbooks_execute_accounting_case",
      "quickbooks_get_accounting_case_status"
    ],
    "neverAllowed": [
      "any xero_* tool",
      "a legacy supplier-bill shortcut while Accounting Case mode is enabled",
      "a generic mutation shortcut while Accounting Case mode is enabled",
      "a write to a production QuickBooks Company",
      "a blind retry after WRITE_RESULT_UNKNOWN or READBACK_MISMATCH"
    ]
  },
  "artifactManifest": [
    {
      "artifactId": "qbo-ra-art-01-customer-master",
      "uploadSlot": 1,
      "sha256Env": "QBO_UAT_ARTIFACT_01_SHA256",
      "logicalType": "CUSTOMER_MASTER_FORM",
      "logicalDocumentNumber": "CMD-2026-0701",
      "businessChain": "AR",
      "sourceBranding": "XERO_TEST_PACK",
      "sourceUnits": [
        {
          "unitId": "qbo-ra-u-01-customer",
          "expectedFactKinds": [
            "CONTACT_CANDIDATE"
          ],
          "terminalDisposition": "SUPPORTED_WRITE_OR_ALREADY_EXISTS"
        }
      ],
      "quickBooksTranslation": "Create or reuse one exact Customer; do not create an invoice from this form alone."
    },
    {
      "artifactId": "qbo-ra-art-02-vendor-onboarding",
      "uploadSlot": 2,
      "sha256Env": "QBO_UAT_ARTIFACT_02_SHA256",
      "logicalType": "VENDOR_ONBOARDING_FORM",
      "logicalDocumentNumber": "SOF-2026-0701",
      "businessChain": "AP",
      "sourceBranding": "XERO_TEST_PACK",
      "sourceUnits": [
        {
          "unitId": "qbo-ra-u-02-vendor",
          "expectedFactKinds": [
            "CONTACT_CANDIDATE",
            "CONTROL_FINDING"
          ],
          "terminalDisposition": "SUPPORTED_WRITE_WITH_REVIEW_ITEM_PRESERVED"
        }
      ],
      "quickBooksTranslation": "Create or reuse one exact Vendor. The stale PENDING CALLBACK bank-verification status remains a review item and the attachment never authorizes a payment."
    },
    {
      "artifactId": "qbo-ra-art-03-inbound-customer-po",
      "uploadSlot": 3,
      "sha256Env": "QBO_UAT_ARTIFACT_03_SHA256",
      "logicalType": "INBOUND_CUSTOMER_PURCHASE_ORDER",
      "logicalDocumentNumber": "PO-LCD-0701",
      "businessChain": "AR",
      "sourceBranding": "XERO_TEST_PACK",
      "sourceUnits": [
        {
          "unitId": "qbo-ra-u-03-inbound-po",
          "expectedFactKinds": [
            "EVIDENCE"
          ],
          "terminalDisposition": "EVIDENCE_ONLY"
        }
      ],
      "quickBooksTranslation": "Customer-issued inbound PO is support for the sales invoice; it is not a QuickBooks supplier-side PurchaseOrder write."
    },
    {
      "artifactId": "qbo-ra-art-04-sales-invoice",
      "uploadSlot": 4,
      "sha256Env": "QBO_UAT_ARTIFACT_04_SHA256",
      "logicalType": "SALES_TAX_INVOICE",
      "logicalDocumentNumber": "INV-2026-0702",
      "businessChain": "AR",
      "sourceBranding": "XERO_TEST_PACK",
      "sourceUnits": [
        {
          "unitId": "qbo-ra-u-04-sales-invoice",
          "expectedFactKinds": [
            "NATIVE_DOCUMENT"
          ],
          "terminalDisposition": "WRITTEN_READBACK_VERIFIED"
        }
      ],
      "quickBooksTranslation": "QuickBooks Invoice, not a generic journal and not a Xero draft-status claim."
    },
    {
      "artifactId": "qbo-ra-art-05-vendor-bill",
      "uploadSlot": 5,
      "sha256Env": "QBO_UAT_ARTIFACT_05_SHA256",
      "logicalType": "VENDOR_TAX_INVOICE",
      "logicalDocumentNumber": "OH-260701",
      "businessChain": "AP",
      "sourceBranding": "XERO_TEST_PACK",
      "sourceUnits": [
        {
          "unitId": "qbo-ra-u-05-vendor-bill",
          "expectedFactKinds": [
            "NATIVE_DOCUMENT"
          ],
          "terminalDisposition": "WRITTEN_READBACK_VERIFIED"
        }
      ],
      "quickBooksTranslation": "QuickBooks Bill for 10 cartons; the separate GRN discrepancy remains a control exception."
    },
    {
      "artifactId": "qbo-ra-art-06-grn",
      "uploadSlot": 6,
      "sha256Env": "QBO_UAT_ARTIFACT_06_SHA256",
      "logicalType": "GOODS_RECEIVED_NOTE",
      "logicalDocumentNumber": "GRN-2026-0703",
      "businessChain": "AP",
      "sourceBranding": "XERO_TEST_PACK",
      "sourceUnits": [
        {
          "unitId": "qbo-ra-u-06-grn",
          "expectedFactKinds": [
            "EVIDENCE",
            "CONTROL_FINDING"
          ],
          "terminalDisposition": "EVIDENCE_ONLY_WITH_WARNING"
        }
      ],
      "quickBooksTranslation": "Control support only: 9 received versus 10 billed. Preserve the 3-way-match exception."
    },
    {
      "artifactId": "qbo-ra-art-07-bank-statement",
      "uploadSlot": 7,
      "sha256Env": "QBO_UAT_ARTIFACT_07_SHA256",
      "logicalType": "SGD_BANK_STATEMENT",
      "logicalDocumentNumber": "STMT-072026",
      "businessChain": "BANK",
      "sourceBranding": "XERO_TEST_PACK",
      "sourceUnits": [
        {
          "unitId": "qbo-ra-u-07-opening-balance",
          "expectedFactKinds": [
            "UNSUPPORTED_EVENT"
          ],
          "terminalDisposition": "BLOCKED_UNSUPPORTED_OPENING_BALANCE"
        },
        {
          "unitId": "qbo-ra-u-07-bill-payment",
          "expectedFactKinds": [
            "UNSUPPORTED_EVENT"
          ],
          "terminalDisposition": "BLOCKED_UNSUPPORTED_BILL_PAYMENT"
        },
        {
          "unitId": "qbo-ra-u-07-customer-payment",
          "expectedFactKinds": [
            "UNSUPPORTED_EVENT"
          ],
          "terminalDisposition": "BLOCKED_UNSUPPORTED_CUSTOMER_PAYMENT"
        },
        {
          "unitId": "qbo-ra-u-07-bank-fee",
          "expectedFactKinds": [
            "UNSUPPORTED_EVENT"
          ],
          "terminalDisposition": "BLOCKED_UNSUPPORTED_BANK_FEE"
        },
        {
          "unitId": "qbo-ra-u-07-customer-prepayment",
          "expectedFactKinds": [
            "UNSUPPORTED_EVENT"
          ],
          "terminalDisposition": "BLOCKED_UNSUPPORTED_CUSTOMER_PREPAYMENT"
        }
      ],